Title,Author full names,Year,Source title,DOI,Publisher
"Automating Postearthquake Recovery in Construction: Leveraging BIM, Deep Learning, and Web Map Services for Efficient Solutions","Oktavianus, Adrianto (56690465400); Chen, Po-Han (7408355488); Lin, Jacob J. (56716901300); Chang, Luh-Maan (7404274683)",2025,Journal of Computing in Civil Engineering,10.1061/JCCEE5.CPENG-6142,American Society of Civil Engineers (ASCE)
Integrating industry foundation classes and knowledge graphs for automated deconstruction planning,"Allam, Amr S. (57213519399); Nik-Bakht, Mazdak (56368493100)",2025,Journal of Building Engineering,10.1016/j.jobe.2025.112564,Elsevier Ltd
Ontology for a Knowledge-Based Deconstruction of Buildings Based on BIM Models and Linked Data Principles,"Jäkel, Jan-Iwo (57886317400); Heinlein, Eva (59677403200); von Czernitzky, Constantin (59676285300); Mackenbach, Sven (57220197249); Klemt-Albert, Katharina (57200299618)",2025,Buildings,10.3390/buildings15050720,Multidisciplinary Digital Publishing Institute (MDPI)
Exploring the Contribution of Digital Twins to the Preservation of Historical Heritage - Case Study of the Casa da Baronesa de Serra Branca,"Lopes Toledo, André Luiz (57204711879); da Silva Santos, Ericksom (59743939800); da Silva, Almir F. (59744595800); Carvalho Clemente, Juliana (59744764200); Lima Silva, Nayara Luana (59743601900); Ribeiro de Oliveira, Maria Cleide (59744104600); Bezerra Braga Gomes de Medeiros, Isabelly (59743939900); Tavares da Costa Freire, Juvenise (59743602000)",2025,Lecture Notes in Civil Engineering,10.1007/978-3-031-87316-4_67,Springer Science and Business Media Deutschland GmbH
DECENTRALIZED DATA NETWORKS FOR LIFECYCLE MANAGEMENT IN THE BUILT ENVIRONMENT,"Bucher, David F. (57219007528); Hunhevicz, Jens J. (57217925661); Byers, Brandon S. (57931282900); Honic, Meliha (57195241850); De Wolf, Catherine (57189463041); Hall, Daniel M. (57202684927)",2025,Journal of Information Technology in Construction,10.36680/j.itcon.2025.034,International Council for Research and Innovation in Building and Construction
"A Framework of ifcJSON-Based Digital Twin Platform for Monitoring Building Environment Using BIM, IoT, and Semantic Web Technologies","Chung, Jihoon (57218248164); Shelden, Dennis (24449549000)",2025,Lecture Notes in Civil Engineering,10.1007/978-3-031-84208-5_4,Springer Science and Business Media Deutschland GmbH
Integration of BIM and GIS for the Digitization of the Built Environment,"Piras, Giuseppe (57219207943); Muzi, Francesco (58075716100); Zylka, Claudia (58568128600)",2024,Applied Sciences (Switzerland),10.3390/app142311171,Multidisciplinary Digital Publishing Institute (MDPI)
IoT and Digital Twin: A new perspective for Cultural Heritage predictive maintenance,"Cecere, L. (56667417100); Colace, F. (6603910841); Lorusso, A. (57226819593); Messina, B. (56541282800); Tucker, A. (57210525029); Santaniello, D. (57197874499)",2024,Procedia Structural Integrity,10.1016/j.prostr.2024.09.334,Elsevier B.V.
Blockchain-Enabled Provenance Tracking for Sustainable Material Reuse in Construction Supply Chains,"Wilson, Stanly (57209244939); Adu-Duodu, Kwabena (57314268300); Li, Yinhao (57207043315); Sham, Ringo (57930692200); Almubarak, Mohammed (59002940500); Wang, Yingli (37074964300); Solaiman, Ellis (6506642705); Perera, Charith (55293491900); Ranjan, Rajiv (57197711780); Rana, Omer (7003659610)",2024,Future Internet,10.3390/fi16040135,Multidisciplinary Digital Publishing Institute (MDPI)
A modular ontology modeling approach to developing digital product passports to promote circular economy in the built environment,"Kebede, Rahel (57943619000); Moscati, Annika (57215358407); Tan, He (57198662890); Johansson, Peter (57225451766)",2024,Sustainable Production and Consumption,10.1016/j.spc.2024.05.007,Elsevier B.V.
Semantic interoperability for cultural heritage conservation: Workflow from ontologies to a tool for managing and sharing data,"Moyano, Juan (57193956769); Pili, Alessandra (57202389503); Nieto-Julián, Juan E. (57204279028); Della Torre, Stefano (6508010123); Bruno, Silvana (57198898259)",2023,Journal of Building Engineering,10.1016/j.jobe.2023.107965,Elsevier Ltd
Life cycle-oriented decision making based on data-driven building models,"Bartels, Niels (57204470034); Pleuser, Josephine (58627616300); Schroeder, Timo (58297247000)",2023,Proceedings of the International Symposium on Automation and Robotics in Construction,10.22260/ISARC2023/0099,International Association for Automation and Robotics in Construction (IAARC)
Digitalization for a circular economy in the building industry: Multiple-case study of Dutch social housing organizations,"Çetin, Sultan (57222071860); Gruis, Vincent (6507557251); Straub, Ad (16481719400)",2022,"Resources, Conservation and Recycling Advances",10.1016/j.rcradv.2022.200110,Elsevier Inc.
TOWARDS CIRCULAR CITIES: DIRECTIONS FOR A MATERIAL PASSPORT ONTOLOGY,"Soman, Ranjith K. (57188757365); Kedir, Firehiwot (57221229203); Hall, Daniel M. (57202684927)",2022,Proceedings of the European Conference on Computing in Construction,10.35490/EC3.2022.212,European Council on Computing in Construction (EC3)
USING ENGRAVED QR CODES TO CONNECT BUILDING COMPONENTS TO MATERIALS PASSPORTS FOR CIRCULAR CONSTRUCTION,"Byers, Brandon (57931282900); Cheriyamulla, Shiji (58701212300); Ewason, Jephta (58701384000); Hall, Daniel (57202684927); De Wolf, Catherine (57189463041)",2022,Proceedings of the European Conference on Computing in Construction,10.35490/EC3.2022.226,European Council on Computing in Construction (EC3)
Decision Support System for the Management of Interventions on Buildings in the Historic Centre of Florence: From Conservation to Regeneration,"Acampa, Giovanna (57203481533); Battisti, Fabrizio (57216624546); Grasso, Mariolina (57205119389)",2023,Lecture Notes in Computer Science (including subseries Lecture Notes in Artificial Intelligence and Lecture Notes in Bioinformatics),10.1007/978-3-031-37126-4_22,Springer Science and Business Media Deutschland GmbH
Optimizing H-BIM Workflow for Interventions on Historical Building Elements,"Guerra de Oliveira, Sara (57204953247); Biancardo, Salvatore Antonio (55915639400); Tibaut, Andrej (23502096300)",2022,Sustainability (Switzerland),10.3390/su14159703,MDPI
A data-driven approach to assess the risk of encountering hazardous materials in the building stock based on environmental inventories,"Wu, Pei-Yu (57226309605); Mjörnell, Kristina (7801503774); Mangold, Mikael (55246691000); Sandels, Claes (36700494800); Johansson, Tim (55358172000)",2021,Sustainability (Switzerland),10.3390/su13147836,MDPI AG
BIM-based Cultural Heritage Asset Management Tool. Innovative Solution to Orient the Preservation and Valorization of Historic Buildings,"Piaia, Emanuele (22986220900); Maietti, F. (56426613800); Di Giulio, R. (55574219360); Schippers-Trifan, O. (57215610675); Van Delft, A. (7004000798); Bruinenberg, S. (57200406928); Olivadese, R. (57215611969)",2021,International Journal of Architectural Heritage,10.1080/15583058.2020.1734686,"Bellwether Publishing, Ltd."
BIM and semantic web-based maintenance information for existing buildings,"Gouda Mohamed, Ahmed (57213324881); Abdallah, Mohamed Reda (57915857900); Marzouk, Mohamed (7005098184)",2020,Automation in Construction,10.1016/j.autcon.2020.103209,Elsevier B.V.
DATA-DRIVEN RIGHTSIZING: INTEGRATING PRESERVATION into the LEGACY CITIES LANDSCAPE,"Evans, Emilie (57195940133); Grosicki, Briana (57195942241)",2017,"ISPRS Annals of the Photogrammetry, Remote Sensing and Spatial Information Sciences",10.5194/isprs-annals-IV-2-W2-83-2017,Copernicus GmbH
Integrating building information modelling and semantic web technologies for the management of built heritage information,"Pauwels, Pieter (36661189900); Bod, Rens (12784000100); Di Mascio, Danilo (55582266800); De Meyer, Ronald (23003858300)",2013,"Proceedings of the DigitalHeritage 2013 - Federating the 19th Int'l VSMM, 10th Eurographics GCH, and 2nd UNESCO Memory of the World Conferences, Plus Special Sessions fromCAA, Arqueologica 2.0 et al.",10.1109/DigitalHeritage.2013.6743787,
Quantitative + qualitative information for heritage conservation: An open science research for paving 'collaboratively' the way to historical-BIM,"Garcia-Fernandez, Jorge (57023326900); Anssi, Joutsiniemi (56259287700); Ahn, Yushin (12041219200); Fernandez, Juan Jose (55455055600)",2015,"2015 Digital Heritage International Congress, Digital Heritage 2015",10.1109/DigitalHeritage.2015.7419495,Institute of Electrical and Electronics Engineers Inc.
The VernArch digital database project: Documentation and protection of the vernacular architecture of Cyprus,"Philokyprou, Maria (35254200000)",2014,Lecture Notes in Computer Science (including subseries Lecture Notes in Artificial Intelligence and Lecture Notes in Bioinformatics),10.1007/978-3-319-13695-0,Springer Verlag
